用户说法,user_data
选择最快的路线,返回|主界面|通知栏|西安大唐丽都公寓酒店|莲湖区北大街1号宏府嘉会广场座八楼8032室|详情下拉图片|西安楼北楼客栈|西安莲湖区北院门131号|西安回民街家庭宾馆|陕西省西安市莲湖区回民美食街中段北院门111号|西安巷声青年客栈钟楼回民街店|回民街西羊市35号|西安撒哈拉青年客栈回民街店|西安市莲湖区北院门180号
开始导航,返回|主界面|通知栏|西安大唐丽都公寓酒店|莲湖区北大街1号宏府嘉会广场座八楼8032室|详情下拉图片|西安楼北楼客栈|西安莲湖区北院门131号|西安回民街家庭宾馆|陕西省西安市莲湖区回民美食街中段北院门111号|西安巷声青年客栈钟楼回民街店|回民街西羊市35号|西安撒哈拉青年客栈回民街店|西安市莲湖区北院门180号
导航到萍乡步行街,返回|主界面|通知栏|路线偏好|距离最短|4小时59分钟|419公里|红绿灯11个|收费225元|时间最短|4小时58分钟|435公里|方案3|5小时7分钟|440公里|开始导航|设置车牌避开杭州市外地车限行|缩小图面|放大图面|仅供测试
在文化路步行街,返回|主界面|通知栏|步行街|萍乡市莲花县|萍乡市安源区
法西诺萍乡步行街旗舰店,返回|主界面|通知栏|铜鼓步行街|宜春市铜鼓县|金马步行街|宜春市丰城市|重桂路步行街|宜春市袁州区|朝阳路步行街|锦绣共和步行街|宜春市共和西路
导航开始,返回|主界面|通知栏|铜鼓步行街|宜春市铜鼓县|金马步行街|宜春市丰城市|重桂路步行街|宜春市袁州区|朝阳路步行街|锦绣共和步行街|宜春市共和西路
我想去武汉,返回|主界面|通知栏|路线偏好|距离最短|4小时59分钟|419公里|红绿灯11个|收费225元|时间最短|4小时58分钟|435公里|方案3|5小时7分钟|440公里|开始导航|设置车牌避开杭州市外地车限行|缩小图面|放大图面|仅供测试
就是沿江大道188号,返回|主界面|通知栏|武汉市|距离648|地址武汉市湖北省武汉市江岸区沿江大道188号
选择收费站少的,返回|主界面|通知栏|武汉市|距离648|地址武汉市湖北省武汉市江岸区沿江大道188号
导航,返回|主界面|通知栏|武汉市|距离648|地址武汉市湖北省武汉市江岸区沿江大道188号
前往广西柳州,返回|主界面|通知栏|加载中
去三中路66号,返回|主界面|通知栏|柳州市|距离426|地址柳州市广西壮族自治区柳州市柳北区三中路66号
选择沿途有加油站的路线,返回|主界面|通知栏|柳州市|距离426|地址柳州市广西壮族自治区柳州市柳北区三中路66号
导航吧,返回|主界面|通知栏|路线偏好|距离最短|4小时26分钟|363公里|红绿灯30个|收费240元|方案2|5小时6分钟|429公里|红绿灯少|5小时11分钟|451公里|开始导航|设置车牌避开武汉市外地车限行|缩小图面|放大图面|仅供测试
我要去武城县托修场,返回|主界面|通知栏|路线偏好|距离最短|4小时26分钟|363公里|红绿灯30个|收费240元|方案2|5小时6分钟|429公里|红绿灯少|5小时11分钟|451公里|开始导航|设置车牌避开武汉市外地车限行|缩小图面|放大图面|仅供测试
去棉厂,返回|主界面|通知栏|路线偏好|距离最短|4小时26分钟|363公里|红绿灯30个|收费240元|方案2|5小时6分钟|429公里|红绿灯少|5小时11分钟|451公里|开始导航|设置车牌避开武汉市外地车限行|缩小图面|放大图面|仅供测试
选择武城县银山棉厂,返回|主界面|通知栏|兰州拉面沧台路|青岛市李沧区|兰州拉面长春路|青岛市市北区|兰州拉面长沙路|兰州牛肉拉面长江二路|青岛市即墨市|青岛市烟青路2729
选择距离最近的,返回|主界面|通知栏|武城县银山棉厂|德州市武城县|武城县银山棉厂南1门|武城县银山棉厂南2门
开始导航,返回|主界面|通知栏|武城县银山棉厂南1门|距离407|地址德州市武城县
帮我导航到赣州市幺零五国道旁边的黄金家园,返回|主界面|通知栏|缩小图面|放大图面|仅供测试
去中国黄金,返回|主界面|通知栏|黄金|赣州市章贡区|大家园|赣州市信丰县|刘家园|赣州市宁都县|中家园|赣州市兴国县|自己家园|赣州市八境路1012号
在西街32号上,返回|主界面|通知栏|中国黄金|温州市梧慈路381|中国黄金安阳店|温州市拱瑞山路198|中国黄金梧慈路|温州市瓯海区|中国黄金罗东街|温州市永中罗东街331号|中国黄金公园路|温州市公园路15
导航,返回|主界面|通知栏|中国黄金|温州市梧慈路381|中国黄金安阳店|温州市拱瑞山路198|中国黄金梧慈路|温州市瓯海区|中国黄金罗东街|温州市永中罗东街331号|中国黄金公园路|温州市公园路15
我想去欧风街,返回|主界面|通知栏|路线偏好|时间最短|7小时28分钟|704公里|红绿灯8个|收费330元|方案2|8小时1分钟|737公里|开始导航|设置车牌避开聊城市外地车限行|缩小图面|放大图面|仅供测试
那就欧风街教堂,返回|主界面|通知栏|欧陆风情酒吧街|深圳市深南大道9037号世界之窗欧风街广场|欧风金箔行|深圳市龙岗区
搜索欧风街教堂附近的加油站,返回|主界面|通知栏|欧陆风情酒吧街|深圳市深南大道9037号世界之窗欧风街广场|欧风金箔行|深圳市龙岗区
选择距离最近的,返回|主界面|通知栏|建业冠德加油站|深圳市布心路2033|东湖加油站|深圳市布心路2033号|广东深圳布吉加油站龙岗大道|深圳市龙岗区|鹏吉源加油站|深圳市布吉路1022|布心加油站|深圳市布心路10101018号
导航,返回|主界面|通知栏|广东深圳布吉加油站龙岗大道|距离56|地址深圳市龙岗区
前往宁乡灰汤,返回|主界面|通知栏|缩小图面|放大图面|仅供测试
去加油站,返回|主界面|通知栏|宁乡农商银行灰汤支行|长沙市宁乡县|灰汤村|灰汤镇|宁乡县灰汤供水有限责任公司|宁乡县国土资源局灰汤镇管理所
走最近的路线,返回|主界面|通知栏|加油站云南南路|上海城区车站东路193号|三电加油站|上海城区重庆南路273|成都路加油站|上海城区成都北路118|国货路加油站|上海城区国货路398|海绿中加油站|上海城区蒙自路278
导航,返回|主界面|通知栏|加油站云南南路|距离550|地址上海城区车站东路193号
我要去黄山,返回|主界面|通知栏|缩小图面|放大图面|仅供测试
到黄山风景区,返回|主界面|通知栏|黄山市|黄山市安徽省黄山市屯溪区天都大道1|黄山区|黄山市安徽省黄山市黄山区036|黄山风景区|黄山市036|黄山市黄山区
就是x036的黄山风景区,返回|主界面|通知栏|黄山风景区|黄山市黄山区|黄山风景区法庭|黄山风景区售票处|黄山风景区博物馆|黄山风景区新国线
选择走高速,返回|主界面|通知栏|黄山风景区|黄山市黄山区|黄山风景区法庭|黄山风景区售票处|黄山风景区博物馆|黄山风景区新国线
开始导航,返回|主界面|通知栏|黄山风景区|黄山市黄山区|黄山风景区法庭|黄山风景区售票处|黄山风景区博物馆|黄山风景区新国线
导航到桐城,返回|主界面|通知栏|路线偏好|时间最短|5小时33分钟|476公里|红绿灯34个|收费245元|收费较少|5小时48分钟|481公里|开始导航|设置车牌避开上海市外地车限行|缩小图面|放大图面|仅供测试
位于公园路2号,返回|主界面|通知栏|桐城市|距离492|地址安庆市安徽省安庆市桐城市公园路2号
搜索桐城附近的酒店,返回|主界面|通知栏|桐城市|距离492|地址安庆市安徽省安庆市桐城市公园路2号
选择好评高的,返回|主界面|通知栏|桐城市|距离492|地址安庆市安徽省安庆市桐城市公园路2号
导航,返回|主界面|通知栏|桐城市|距离492|地址安庆市安徽省安庆市桐城市公园路2号
我想去定西市临洮县,返回|主界面|通知栏|路线偏好|时间最短|1小时33分钟|122公里|红绿灯14个|收费60元|距离最短|1小时52分钟|110公里|开始导航|缩小图面|放大图面|仅供测试
去东大街4号,返回|主界面|通知栏|临洮县|距离306|地址定西市甘肃省定西市临洮县东大街4号
走红路灯最少的路线,返回|主界面|通知栏|东大街|武威市民勤县|武威市凉州区|东大街街道|龙泰东大街|康奈东大街
导航吧,返回|主界面|通知栏|东大街|武威市民勤县|武威市凉州区|东大街街道|龙泰东大街|康奈东大街
帮我导航到嘉定区黄渡镇,返回|主界面|通知栏|路线偏好|时间最短|1小时33分钟|122公里|红绿灯14个|收费60元|距离最短|1小时52分钟|110公里|开始导航|缩小图面|放大图面|仅供测试
就在博园路,返回|主界面|通知栏|黄渡镇|距离332|地址上海城区嘉定区
就是黄渡镇汽车服务中心,返回|主界面|通知栏|黄渡镇|距离332|地址上海城区嘉定区
选择距离最近的,返回|主界面|通知栏|合众汽车服务中心|淮安市涟水县|乐行汽车服务中心|博奥汽车服务中心|美驹汽车服务中心|淮安市淮海西路26814|广远汽车服务中心|淮安市淮安经济开发区威海路5号
开始导航,返回|主界面|通知栏|佳盛汽车服务中心|距离24|地址淮安市清河区
前往开封市禹王台风景区,返回|主界面|通知栏|缩小图面|放大图面|仅供测试
位于三里堡街45号,返回|主界面|通知栏|路线偏好|时间最短|4小时1分钟|347公里|红绿灯30个|收费155元|收费较少|4小时54分钟|361公里|开始导航|设置车牌避开南京市外地车限行|缩小图面|放大图面|仅供测试
去开封市禹王台区监察局,返回|主界面|通知栏|路线偏好|时间最短|4小时1分钟|347公里|红绿灯30个|收费155元|收费较少|4小时54分钟|361公里|开始导航|设置车牌避开南京市外地车限行|缩小图面|放大图面|仅供测试
导航,返回|主界面|通知栏|路线偏好|时间最短|4小时1分钟|347公里|红绿灯30个|收费155元|收费较少|4小时54分钟|361公里|开始导航|设置车牌避开南京市外地车限行|缩小图面|放大图面|仅供测试
我要去西安火车站,返回|主界面|通知栏|路线偏好|时间最短|4小时1分钟|347公里|红绿灯30个|收费155元|收费较少|4小时54分钟|361公里|开始导航|设置车牌避开南京市外地车限行|缩小图面|放大图面|仅供测试
就是去临潼火车站,返回|主界面|通知栏|西安站|西安市环城北路44号|西安站南进站口|西安站南出站口|西安市环城北路|西安西站|西安市建中巷32|西安东站|西安市新城区
搜索最快的路线,返回|主界面|通知栏|临潼站|距离45|地址西安市临潼区
开始导航,返回|主界面|通知栏|临潼站|距离45|地址西安市临潼区
导航到桂林,返回|主界面|通知栏|加载中
选择桂林市,返回|主界面|通知栏|桂林市|距离1009|地址桂林市广西壮族自治区桂林市秀峰区五美路16号
搜索桂林附近的酒店,返回|主界面|通知栏|桂林市|距离1009|地址桂林市广西壮族自治区桂林市秀峰区五美路16号
选择价格最低的,返回|主界面|通知栏|西安蓝田桂林宾馆|距离37|地址陕西省西安市蓝田县汤峪镇塘子村
导航吧,返回|主界面|通知栏|西安蓝田桂林宾馆|距离37|地址陕西省西安市蓝田县汤峪镇塘子村
我要去武汉汉正街,返回|主界面|通知栏|加载中
去汉正街控股集团公司,返回|主界面|通知栏|汉正街|武汉市~口区|武汉市江汉区
在洞庭街139，不在公园环路2,返回|主界面|通知栏|宏达集团轮渡公司|黄冈市黄州区|东方集团全顺公司|黄冈市英山县|湖北武穴百园集团公司|黄冈市武穴市|嘉禾装饰集团黄冈公司|黄冈市八一路|上海上丰集团有限公司|黄冈市红安县
导航,返回|主界面|通知栏|宏达集团轮渡公司|黄冈市黄州区|东方集团全顺公司|黄冈市英山县|湖北武穴百园集团公司|黄冈市武穴市|嘉禾装饰集团黄冈公司|黄冈市八一路|上海上丰集团有限公司|黄冈市红安县
我要到新闻中心,返回|主界面|通知栏|加载中
广州市南沙区新闻中心,返回|主界面|通知栏|花都新闻中心|广州市聚贤街20号|广州市新闻中心|广州市华利路61|广州市黄埔区新闻中心|广州市港湾路596号|南方医科大学新闻中心|广州市同和镇|广州市南沙区新闻中心|广州市南沙区
选择最近路线,返回|主界面|通知栏|广州市黄埔区新闻中心|广州市港湾路596号|广州市南沙区新闻中心|广州市南沙区
导航,返回|主界面|通知栏|广州市黄埔区新闻中心|广州市港湾路596号|广州市南沙区新闻中心|广州市南沙区
我要导航去凉城,返回|主界面|通知栏|缩小图面|放大图面|仅供测试
高凉郡古城,返回|主界面|通知栏|凉城县|距离78|地址乌兰察布市内蒙古自治区乌兰察布市凉城县青林街
搜索高凉郡古城附近的旅游景点,返回|主界面|通知栏|凉城县|距离78|地址乌兰察布市内蒙古自治区乌兰察布市凉城县青林街
选择门票便宜的,返回|主界面|通知栏|高凉郡古城|茂名市高州市|西城门|西村庙|中华第一冼太庙|电白郡遗址
导航吧,返回|主界面|通知栏|高凉郡古城|茂名市高州市|西城门|西村庙|中华第一冼太庙|电白郡遗址
导航到上海金山廊下生态园,返回|主界面|通知栏|缩小图面|放大图面|仅供测试
在廊下生态园,返回|主界面|通知栏|廊下生态园|上海城区金山廊下镇漕廊公路9133号|廊下生态园北门|上海城区漕廊公路9133号附近
走收费最少的线路,返回|主界面|通知栏|廊下生态园|上海城区金山廊下镇漕廊公路9133号|廊下生态园北门|上海城区漕廊公路9133号附近
导航吧,返回|主界面|通知栏|廊下生态园|上海城区金山廊下镇漕廊公路9133号|廊下生态园北门|上海城区漕廊公路9133号附近
导航去乌鲁木齐,返回|主界面|通知栏|缩小图面|放大图面|仅供测试
我要到射击场路,返回|主界面|通知栏|乌鲁木齐市|乌鲁木齐市新疆维吾尔自治区乌鲁木齐市天山区|乌鲁木齐县|乌鲁木齐市新疆维吾尔自治区乌鲁木齐市乌鲁木齐县
距离最近,返回|主界面|通知栏|乌鲁木齐市|乌鲁木齐市新疆维吾尔自治区乌鲁木齐市天山区|乌鲁木齐县|乌鲁木齐市新疆维吾尔自治区乌鲁木齐市乌鲁木齐县
开始导航,返回|主界面|通知栏|乌鲁木齐市|距离3304|地址乌鲁木齐市新疆维吾尔自治区乌鲁木齐市天山区
我现在要去汪清县,返回|主界面|通知栏|加载中
就在汪清街392号,返回|主界面|通知栏|路线偏好|推荐|1天17小时|3484公里|红绿灯23个|收费1195元|开始导航|设置车牌避开乌鲁木齐市外地车限行|缩小图面|放大图面|仅供测试
搜索沿途有饭店的路线,返回|主界面|通知栏|路线偏好|推荐|1天17小时|3484公里|红绿灯23个|收费1195元|开始导航|设置车牌避开乌鲁木齐市外地车限行|缩小图面|放大图面|仅供测试
导航开始吧,返回|主界面|通知栏|路线偏好|推荐|1天17小时|3484公里|红绿灯23个|收费1195元|开始导航|设置车牌避开乌鲁木齐市外地车限行|缩小图面|放大图面|仅供测试
我要去易通路,返回|主界面|通知栏|路线偏好|推荐|1天17小时|3484公里|红绿灯23个|收费1195元|开始导航|设置车牌避开乌鲁木齐市外地车限行|缩小图面|放大图面|仅供测试
到易通路87号,返回|主界面|通知栏|路线偏好|推荐|1天17小时|3484公里|红绿灯23个|收费1195元|开始导航|设置车牌避开乌鲁木齐市外地车限行|缩小图面|放大图面|仅供测试
选择不走高架的,返回|主界面|通知栏|路线偏好|推荐|1天17小时|3484公里|红绿灯23个|收费1195元|开始导航|设置车牌避开乌鲁木齐市外地车限行|缩小图面|放大图面|仅供测试
导航,返回|主界面|通知栏|路线偏好|推荐|1天17小时|3484公里|红绿灯23个|收费1195元|开始导航|设置车牌避开乌鲁木齐市外地车限行|缩小图面|放大图面|仅供测试
我要到宝远宝马四s店,返回|主界面|通知栏|路线偏好|推荐|1天17小时|3484公里|红绿灯23个|收费1195元|开始导航|设置车牌避开乌鲁木齐市外地车限行|缩小图面|放大图面|仅供测试
就在人民北路附近,返回|主界面|通知栏|大理宝远汽车销售服务有限公司|大理白族自治州凤仪镇千户营村丰赢汽车城内|大理白族自治州凤仪镇千户营村丰赢汽车城
走高速路线,返回|主界面|通知栏|大理宝远汽车销售服务有限公司|大理白族自治州凤仪镇千户营村丰赢汽车城内|大理白族自治州凤仪镇千户营村丰赢汽车城
导航吧,返回|主界面|通知栏|大理宝远汽车销售服务有限公司|大理白族自治州凤仪镇千户营村丰赢汽车城内|大理白族自治州凤仪镇千户营村丰赢汽车城
我准备去七里乡政府,返回|主界面|通知栏|路线偏好|推荐|1天17小时|3484公里|红绿灯23个|收费1195元|开始导航|设置车牌避开乌鲁木齐市外地车限行|缩小图面|放大图面|仅供测试
就在滨河北路044,返回|主界面|通知栏|驾车乡政府|曲靖市会泽县|七里牌|七里店|曲靖市宣威市|普立乡人民政府|龙海乡人民政府|曲靖市陆良县
搜索滨河北路附近便宜的酒店,返回|主界面|通知栏|驾车乡政府|曲靖市会泽县|七里牌|七里店|曲靖市宣威市|普立乡人民政府|龙海乡人民政府|曲靖市陆良县
选择速8,返回|主界面|通知栏|驾车乡政府|曲靖市会泽县|七里牌|七里店|曲靖市宣威市|普立乡人民政府|龙海乡人民政府|曲靖市陆良县
导航开始,返回|主界面|通知栏|驾车乡政府|曲靖市会泽县|七里牌|七里店|曲靖市宣威市|普立乡人民政府|龙海乡人民政府|曲靖市陆良县
我要去雷家店镇,返回|主界面|通知栏|路线偏好|推荐|1天17小时|3484公里|红绿灯23个|收费1195元|开始导航|设置车牌避开乌鲁木齐市外地车限行|缩小图面|放大图面|仅供测试
雷家店镇,返回|主界面|通知栏|雷家|上海城区金山区|罗店镇|上海城区宝山区|雷家宅|雷家桥
选择路况好点的路线,返回|主界面|通知栏|雷家|上海城区金山区|罗店镇|上海城区宝山区|雷家宅|雷家桥
导航,返回|主界面|通知栏|雷家|上海城区金山区|罗店镇|上海城区宝山区|雷家宅|雷家桥
帮我导航公明汽车站,返回|主界面|通知栏|应用列表
在松白路5015,返回|主界面|通知栏|公明汽车站港兴创业大厦东南|距离25|地址深圳市松白路5015号
现在红绿灯最少的路线,返回|主界面|通知栏|公明汽车站港兴创业大厦东南|距离25|地址深圳市松白路5015号
开始导航吧,返回|主界面|通知栏|公明汽车站港兴创业大厦东南|距离25|地址深圳市松白路5015号
我要去嵩山路新会路,返回|主界面|通知栏|仅供测试
嵩山南路和新世纪大街,返回|主界面|通知栏|汉水路和嵩山路南岗区|哈尔滨市南岗区|黄河路和嵩山路南岗区|闽江路和嵩山路南岗区|浦江路和嵩山路南岗区|嵩山路南岗区和轩辕路
走红路灯少的路线,返回|主界面|通知栏|新世纪眼镜牌路大街|哈尔滨市解放大街93|新世纪网吧尚志大街|哈尔滨市西大直街151号|新世纪超市建设大街|哈尔滨市五常市|新世纪鞋行顺天府大街|新世纪家政|哈尔滨市第二方圆里19
导航,返回|主界面|通知栏|新世纪眼镜牌路大街|哈尔滨市解放大街93|新世纪网吧尚志大街|哈尔滨市西大直街151号|新世纪超市建设大街|哈尔滨市五常市|新世纪鞋行顺天府大街|新世纪家政|哈尔滨市第二方圆里19
我要去孝感杨店镇,返回|主界面|通知栏|路线偏好|距离最短|14小时25分钟|1234公里|红绿灯28个|收费585元|红绿灯少|17小时17分钟|1458公里|开始导航|设置车牌避开深圳市外地车限行|缩小图面|放大图面|仅供测试
去杨店镇,返回|主界面|通知栏|杨店镇|距离717|地址孝感市孝南区
选择孝感市杨店镇政府,返回|主界面|通知栏|杨店镇|距离717|地址孝感市孝南区
开始导航吧,返回|主界面|通知栏|杨店镇人民政府|孝感市杨店镇|杨店镇|孝感市孝南区|孝感市杨店镇法庭|孝感市杨店镇国土所|孝感市杨店镇司法所
我要去粥家庄小区,返回|主界面|通知栏|路线偏好|距离最短|14小时25分钟|1234公里|红绿灯28个|收费585元|红绿灯少|17小时17分钟|1458公里|开始导航|设置车牌避开深圳市外地车限行|缩小图面|放大图面|仅供测试
华联小区,返回|主界面|通知栏|路线偏好|距离最短|14小时25分钟|1234公里|红绿灯28个|收费585元|红绿灯少|17小时17分钟|1458公里|开始导航|设置车牌避开深圳市外地车限行|缩小图面|放大图面|仅供测试
走高架,返回|主界面|通知栏|路线偏好|距离最短|14小时25分钟|1234公里|红绿灯28个|收费585元|红绿灯少|17小时17分钟|1458公里|开始导航|设置车牌避开深圳市外地车限行|缩小图面|放大图面|仅供测试
导航,返回|主界面|通知栏|路线偏好|距离最短|14小时25分钟|1234公里|红绿灯28个|收费585元|红绿灯少|17小时17分钟|1458公里|开始导航|设置车牌避开深圳市外地车限行|缩小图面|放大图面|仅供测试
我要去铜仁市妇女儿童医院,返回|主界面|通知栏|路线偏好|距离最短|14小时25分钟|1234公里|红绿灯28个|收费585元|红绿灯少|17小时17分钟|1458公里|开始导航|设置车牌避开深圳市外地车限行|缩小图面|放大图面|仅供测试
就是铜仁妇女儿童医院,返回|主界面|通知栏|铜仁妇女儿童医院|铜仁市铜江路9号|铜仁市儿童福利院|铜仁市新华中路108号|铜仁市万山区妇女联合会|铜仁市万山区|铜仁市儿童福利院江口康复中心|铜仁市江口县
选择最近的,返回|主界面|通知栏|铜仁妇女儿童医院|铜仁市铜江路9号|铜仁市儿童福利院|铜仁市新华中路108号|铜仁市万山区妇女联合会|铜仁市万山区|铜仁市儿童福利院江口康复中心|铜仁市江口县
还是换条线路吧,返回|主界面|通知栏|铜仁市万山区妇女联合会|距离1127|地址铜仁市万山区
可以，导航,返回|主界面|通知栏|铜仁市万山区妇女联合会|距离1127|地址铜仁市万山区
我要到广州荔湾区,返回|主界面|通知栏|缩小图面|放大图面|仅供测试
位于中山七路330,返回|主界面|通知栏|荔湾区|距离1132|地址广州市广东省广州市荔湾区中山七路330
不上高架,返回|主界面|通知栏|荔湾区|距离1132|地址广州市广东省广州市荔湾区中山七路330
导航吧,返回|主界面|通知栏|荔湾区|距离1132|地址广州市广东省广州市荔湾区中山七路330
我要导航崇礼县政府,返回|主界面|通知栏|缩小图面|放大图面|仅供测试
我要去崇礼县政府,返回|主界面|通知栏|崇礼县人民政府|张家口市长青路30|崇礼县人民政府信访局|崇礼县石窑子乡人民政府|张家口市崇礼县|崇礼县人民政府教育督导室|崇礼县人民政府残疾人工作委员会办公室
崇礼区石咀子乡政府,返回|主界面|通知栏|崇礼县人民政府|张家口市长青路30|崇礼县人民政府信访局|崇礼县石窑子乡人民政府|张家口市崇礼县|崇礼县人民政府教育督导室|崇礼县人民政府残疾人工作委员会办公室
导航吧,返回|主界面|通知栏|崇礼县人民政府|张家口市长青路30|崇礼县人民政府信访局|崇礼县石窑子乡人民政府|张家口市崇礼县|崇礼县人民政府教育督导室|崇礼县人民政府残疾人工作委员会办公室
我要去十八月潭,返回|主界面|通知栏|路线偏好|距离最短|13小时55分钟|1223公里|红绿灯14个|收费630元|拥堵较少|16小时18分钟|1374公里|开始导航|设置车牌避开南昌市外地车限行|缩小图面|放大图面|仅供测试
就在米仓山国家森林公园西南部,返回|主界面|通知栏|十八月潭景区|距离1292|地址巴中市南江县
走高速路线,返回|主界面|通知栏|十八月潭景区|距离1292|地址巴中市南江县
导航,返回|主界面|通知栏|十八月潭景区|距离1292|地址巴中市南江县
导航去株洲,返回|主界面|通知栏|加载中
就在学堂路1号,返回|主界面|通知栏|株洲市|株洲市湖南省株洲市天元区天台路60|株洲县|株洲市湖南省株洲市株洲县学堂路1号
搜索学堂路附近的加油站,返回|主界面|通知栏|株洲市|株洲市湖南省株洲市天元区天台路60|株洲县|株洲市湖南省株洲市株洲县学堂路1号
选择中国石油,返回|主界面|通知栏|株洲市|株洲市湖南省株洲市天元区天台路60|株洲县|株洲市湖南省株洲市株洲县学堂路1号
开始导航吧,返回|主界面|通知栏|株洲市|株洲市湖南省株洲市天元区天台路60|株洲县|株洲市湖南省株洲市株洲县学堂路1号
