用户说法,user_data
开始导航,返回|主界面|通知栏|路线偏好|时间最短|5小时33分钟|510公里|红绿灯17个|收费250元|方案2|6小时24分钟|611公里|开始导航|连霍高速因施工封路已为您避开|缩小图面|放大图面|仅供测试
我要到咸阳卓越汽车营,返回|主界面|通知栏|路线偏好|时间最短|5小时33分钟|510公里|红绿灯17个|收费250元|方案2|6小时24分钟|611公里|开始导航|连霍高速因施工封路已为您避开|缩小图面|放大图面|仅供测试
就在汽车站附近,返回|主界面|通知栏|咸阳卓越汽车销售服务有限公司|咸阳市北上召汽车产业园上召路一排二号|华越汽车美容装潢|咸阳市彬县|鸿越汽车销售中心|咸阳市三原县|超越汽车轮胎销售中心|咸阳市杨陵区
选择走高速,返回|主界面|通知栏|咸阳卓越汽车销售服务有限公司|咸阳市北上召汽车产业园上召路一排二号|华越汽车美容装潢|咸阳市彬县|鸿越汽车销售中心|咸阳市三原县|超越汽车轮胎销售中心|咸阳市杨陵区
导航,返回|主界面|通知栏|咸阳卓越汽车销售服务有限公司|咸阳市北上召汽车产业园上召路一排二号|华越汽车美容装潢|咸阳市彬县|鸿越汽车销售中心|咸阳市三原县|超越汽车轮胎销售中心|咸阳市杨陵区
我要去北翟路华江路,返回|主界面|通知栏|定位中|请行驶至开阔地带|永和路|仅供测试
就是北虹路和北翟路,返回|主界面|通知栏|大兜路和仁和仓北弄|杭州市拱墅区|丽水路和仁和仓北弄|仁和仓北弄和大兜路|仁和仓北弄和丽水路|仁和仓北弄和沙河弄
不是北渔路，是北虹路,返回|主界面|通知栏|大兜路和仁和仓北弄|杭州市拱墅区|丽水路和仁和仓北弄|仁和仓北弄和大兜路|仁和仓北弄和丽水路|仁和仓北弄和沙河弄
导航,返回|主界面|通知栏|大兜路和仁和仓北弄|杭州市拱墅区|丽水路和仁和仓北弄|仁和仓北弄和大兜路|仁和仓北弄和丽水路|仁和仓北弄和沙河弄
我要前往康定东路三号三弄,返回|主界面|通知栏|定位中|请行驶至开阔地带|永和路|仅供测试
去东大街85,返回|主界面|通知栏|康定东路|上海城区静安区|环山东路|甘孜藏族自治州康定市|阿迪达斯沿河东路|甘孜藏族自治州沿河东路71号|顺风肥牛沿河东路|甘孜藏族自治州沿河东路5号|雅琳火锅串串沿河东路|甘孜藏族自治州沿河东路66号
搜索东大街附近的停车场,返回|主界面|通知栏|东大街|上海城区松江区|永东大街|上海城区嘉定区|嘉定东大街|汇丰东大街|上海城区金山区|张堰东大街
走最近的路线,返回|主界面|通知栏|停车场和静路|上海城区嘉定区|停车场秦安路|停车场昌吉路|停车场新源路
开始导航,返回|主界面|通知栏|停车场昌吉路|距离31|地址上海城区嘉定区
我想去三家店,返回|主界面|通知栏|缩小图面|放大图面|仅供测试
甘霖电动三轮车幸福人家直营店,返回|主界面|通知栏|凤山家电|温州市建兴东路468号|屿山家电|温州市永建路129号|茗山家电|温州市楠江西路6365号|江山家电超市|温州市江山东路951号5|西山家电制冷维修|温州市瓯海区
走红路灯最少的路线,返回|主界面|通知栏|利友轮胎直营店|温州市莘塍104国道边仙甲段800号|北汽威旺瑞安直营店|温州市瑞安市|风行汽车瑞安直营店|温州市塘下镇岑头村岑头东路92102号|观致汽车瑞安天隆直营店|温州市莘塍镇仙桥北路1号|广汽传祺奔城瑞安直营店|温州市莘塍瑞温公路999号
导航,返回|主界面|通知栏|利友轮胎直营店|温州市莘塍104国道边仙甲段800号|北汽威旺瑞安直营店|温州市瑞安市|风行汽车瑞安直营店|温州市塘下镇岑头村岑头东路92102号|观致汽车瑞安天隆直营店|温州市莘塍镇仙桥北路1号|广汽传祺奔城瑞安直营店|温州市莘塍瑞温公路999号
我要去城东中学,返回|主界面|通知栏|路线偏好|距离最短|4小时48分钟|443公里|红绿灯13个|收费235元|收费较少|5小时|448公里|方案3|5小时30分钟|493公里|开始导航|设置车牌避开上海市外地车限行|缩小图面|放大图面|仅供测试
选择乐清市城东第一中学,返回|主界面|通知栏|城东第一中学|温州市乐清市|城东第二中学|温州市金凤路1号|乐清市城东第一中学|温州市城东街道|城东路|温州市洞头区|温州市文成县
走高速路线,返回|主界面|通知栏|乐清市城东第一中学|距离39|地址温州市城东街道
导航吧,返回|主界面|通知栏|乐清市城东第一中学|距离39|地址温州市城东街道
我想去北洋度假村,返回|主界面|通知栏|加载中
选择第一个,返回|主界面|通知栏|北洋度假村|距离45|地址上海郊县合五公路4077
不是，选第二个,返回|主界面|通知栏|北洋度假村|距离45|地址上海郊县合五公路4077
去距离最近的,返回|主界面|通知栏|北洋度假村|距离45|地址上海郊县合五公路4077
开始导航,返回|主界面|通知栏|北洋度假村|距离45|地址上海郊县合五公路4077
我要去贵阳龙洞堡机场,返回|主界面|通知栏|北洋度假村|距离45|地址上海郊县合五公路4077
去南明区机场路1号,返回|主界面|通知栏|贵阳龙洞堡国际机场|贵阳市机场路1号|贵阳龙洞堡国际机场2号航站楼|贵阳市龙洞堡附近贵阳龙洞堡国际机场|贵阳龙洞堡国际机场1号航站楼
搜索附近的如家酒店,返回|主界面|通知栏|贵阳龙洞堡国际机场|贵阳市机场路1号|贵阳龙洞堡国际机场2号航站楼|贵阳市龙洞堡附近贵阳龙洞堡国际机场|贵阳龙洞堡国际机场1号航站楼
导航,返回|主界面|通知栏|荆门广鑫宾馆|荆门掇刀区象山大道129号|详情下拉图片|荆门文峰宾馆|塔影路12号|荆门家欣宾馆|天鹅路仁爱医院东侧|荆门富都宾馆|荆门东宝区天鹅广场北面|荆门尚客优骏怡连锁酒店|荆门东宝区白云大道105号
动身去星河时代,返回|主界面|通知栏|路线偏好|时间最短|5小时54分钟|551公里|红绿灯11个|收费320元|方案2|6小时6分钟|557公里|距离最短|6小时8分钟|539公里|开始导航|设置车牌避开上海市外地车限行|缩小图面|放大图面|仅供测试
那就去星河蓝湾时代广场,返回|主界面|通知栏|路线偏好|时间最短|5小时54分钟|551公里|红绿灯11个|收费320元|方案2|6小时6分钟|557公里|距离最短|6小时8分钟|539公里|开始导航|设置车牌避开上海市外地车限行|缩小图面|放大图面|仅供测试
我要走耗时少的路线,返回|主界面|通知栏|时代广场|广州市天河区|星河广场|广州市从化区|永泰时代广场|广州市同泰路91|同发时代广场|广州市新造镇|喜来时代广场|广州市龙归长虹村
导航吧,返回|主界面|通知栏|时代广场|广州市天河区|星河广场|广州市从化区|永泰时代广场|广州市同泰路91|同发时代广场|广州市新造镇|喜来时代广场|广州市龙归长虹村
帮我导航到宝胜电缆厂,返回|主界面|通知栏|路线偏好|时间最短|5小时54分钟|551公里|红绿灯11个|收费320元|方案2|6小时6分钟|557公里|距离最短|6小时8分钟|539公里|开始导航|设置车牌避开上海市外地车限行|缩小图面|放大图面|仅供测试
去扬州市凤鸣电缆厂,返回|主界面|通知栏|宝应县宝升电缆厂工会|扬州市宝应县|宝胜电缆城|宝胜电气|扬州市电缆厂|扬州市湾头镇迎宾路8号|宝胜电缆科技城
要走最近的路线,返回|主界面|通知栏|扬州市电缆厂|扬州市湾头镇迎宾路8号|扬州常安电缆厂|扬州市邗江区|扬州东方电缆厂|扬州市东方路27|扬州市华光电缆厂|扬州市高邮市|扬州市斯拜秀电缆厂|扬州市宝应县
开始导航,返回|主界面|通知栏|扬州东方电缆厂|距离55|地址扬州市东方路27
导航到洞口县,返回|主界面|通知栏|加载中
在桔诚西路,返回|主界面|通知栏|洞口县|距离999|地址邵阳市湖南省邵阳市洞口县桔诚西路
搜索桔诚西路附近有名的景点,返回|主界面|通知栏|洞口县|距离999|地址邵阳市湖南省邵阳市洞口县桔诚西路
选择最近,返回|主界面|通知栏|石门景点|温州市乐清市|雁湖景点|红军楼景点|温州市平阳县|仙人硐景点|仙游硐景点
导航开始,返回|主界面|通知栏|石门景点|温州市乐清市|雁湖景点|红军楼景点|温州市平阳县|仙人硐景点|仙游硐景点
我要去六盘山镇,返回|主界面|通知栏|路线偏好|距离最短|2小时54分钟|257公里|红绿灯13个|收费105元|方案2|3小时36分钟|310公里|开始导航|设置车牌避开南京市外地车限行|缩小图面|放大图面|仅供测试
去六盘山镇第一小学,返回|主界面|通知栏|广州市番禺区灵山镇商会|广州市南沙区|番禺区灵山镇中心幼儿园|广州市环城西路48|番禺市莲花山镇水陆运输站|广州市莲花东路75|番禺区灵山镇雁沙村卫生站|广州市番禺区灵山镇国土所
选择一条人少的路线,返回|主界面|通知栏|广州市番禺区灵山镇商会|广州市南沙区|番禺区灵山镇中心幼儿园|广州市环城西路48|番禺市莲花山镇水陆运输站|广州市莲花东路75|番禺区灵山镇雁沙村卫生站|广州市番禺区灵山镇国土所
导航开始吧,返回|主界面|通知栏|广州市番禺区灵山镇商会|距离43|地址广州市南沙区
我要到太极岛水上乐园,返回|主界面|通知栏|加载中
到开心岛儿童水上主题俱乐部,返回|主界面|通知栏|长隆水上乐园|广州市长隆欢乐世界内|黄金海岸水上乐园|广州市滨江东路29|长隆水上乐园正门|水上乐园鹤亭西路|广州市白云区|黄金海岸水上乐园西南门|广州市滨江东路29号
就在工业大道中400-28,返回|主界面|通知栏|开心城堡儿童主题乐园|广州市天河区|开心哈乐室内儿童主题亲子乐园贝贝乐店|广州市番禺区|开心哈乐室内儿童主题亲子乐园西华北直街|广州市宝业路518号醒目仔育才中心2层|国泰俱乐部|广州市海员路119121|东英俱乐部|广州市棠东东南路7号
导航,返回|主界面|通知栏|开心城堡儿童主题乐园|广州市天河区|开心哈乐室内儿童主题亲子乐园贝贝乐店|广州市番禺区|开心哈乐室内儿童主题亲子乐园西华北直街|广州市宝业路518号醒目仔育才中心2层|国泰俱乐部|广州市海员路119121|东英俱乐部|广州市棠东东南路7号
我想去大郎寨,返回|主界面|通知栏|路线偏好|时间最短|14小时14分钟|1259公里|红绿灯16个|收费620元|方案2|16小时35分钟|1422公里|开始导航|设置车牌避开南昌市外地车限行|缩小图面|放大图面|仅供测试
利郎,返回|主界面|通知栏|路线偏好|时间最短|14小时14分钟|1259公里|红绿灯16个|收费620元|方案2|16小时35分钟|1422公里|开始导航|设置车牌避开南昌市外地车限行|缩小图面|放大图面|仅供测试
在鸿坤广场2层-19,返回|主界面|通知栏|路线偏好|时间最短|14小时14分钟|1259公里|红绿灯16个|收费620元|方案2|16小时35分钟|1422公里|开始导航|设置车牌避开南昌市外地车限行|缩小图面|放大图面|仅供测试
导航开始,返回|主界面|通知栏|路线偏好|时间最短|14小时14分钟|1259公里|红绿灯16个|收费620元|方案2|16小时35分钟|1422公里|开始导航|设置车牌避开南昌市外地车限行|缩小图面|放大图面|仅供测试
动身去五河县,返回|主界面|通知栏|路线偏好|时间最短|14小时14分钟|1259公里|红绿灯16个|收费620元|方案2|16小时35分钟|1422公里|开始导航|设置车牌避开南昌市外地车限行|缩小图面|放大图面|仅供测试
淮河路1018号上的,返回|主界面|通知栏|五河县|距离764|地址蚌埠市安徽省蚌埠市五河县淮河路1018号
走高速路线,返回|主界面|通知栏|五河县|距离764|地址蚌埠市安徽省蚌埠市五河县淮河路1018号
开始导航吧,返回|主界面|通知栏|五河县|距离764|地址蚌埠市安徽省蚌埠市五河县淮河路1018号
我要去合肥市警官学院,返回|主界面|通知栏|加载中
就是清溪路78号,返回|主界面|通知栏|安徽警官职业学院南门|合肥市清溪路78号|安徽警官职业学院清溪路|景观庭院|合肥市长江西路960号|安徽警官职业学院东校区|合肥市清溪路13号|安徽警官学院学术交流中心
选择安徽警官学院学术交流中心,返回|主界面|通知栏|安徽警官职业学院南门|合肥市清溪路78号|安徽警官职业学院清溪路|景观庭院|合肥市长江西路960号|安徽警官职业学院东校区|合肥市清溪路13号|安徽警官学院学术交流中心
导航,返回|主界面|通知栏|广外国际学术交流中心|广州市白云大道北2|广州大学学术交流中心|广州市桂花路23|广东省医学学术交流中心|广州市惠福西路123号|广州大学国际学术交流中心|广州市中环西路230号|华南理工大学学术交流中心|广州市天河区
我要前往中邮物流,返回|主界面|通知栏|路线偏好|时间最短|2小时40分钟|223公里|红绿灯12个|收费90元|距离最短|2小时44分钟|217公里|开始导航|缩小图面|放大图面|仅供测试
我要去中国邮政速递物流,返回|主界面|通知栏|山东中邮物流有限责任公司胶南分公司|青岛市黄岛区|增益物流|青岛市即墨市|华晟物流|唐勇物流|复兴物流
在滨海大道中国海洋大学崂山校区,返回|主界面|通知栏|中国邮政速递物流|青岛市崂山区|中国邮政速递物流南流路|青岛市城阳区|中国邮政速递物流永吉路|青岛市永吉路65号|中国邮政速递物流乐环路|青岛市市北区|中国邮政速递物流珠峰街|青岛市黄岛区
导航开始,返回|主界面|通知栏|滨海大道|天津城区滨海新区|滨海县海洋局|盐城市中市中路18|天津市团校滨海校区|中国海洋档案馆|天津城区庐山道2135|北京大学滨海医院|天津城区浙江路63附近
我想去咸阳市武功县,返回|主界面|通知栏|路线偏好|时间最短|2小时40分钟|223公里|红绿灯12个|收费90元|距离最短|2小时44分钟|217公里|开始导航|缩小图面|放大图面|仅供测试
在人民路,返回|主界面|通知栏|武功县|距离1373|地址咸阳市陕西省咸阳市武功县人民路
选择红路灯少的路线,返回|主界面|通知栏|武功县|距离1373|地址咸阳市陕西省咸阳市武功县人民路
导航,返回|主界面|通知栏|周红路|距离25|地址温州市瑞安市
导航到遵义湄潭,返回|主界面|通知栏|缩小图面|放大图面|仅供测试
在文昌巷,返回|主界面|通知栏|湄潭县|距离875|地址遵义市贵州省遵义市湄潭县文昌巷
不走高速,返回|主界面|通知栏|广昌巷|深圳市龙岗区|吉昌巷|文昌路|深圳市宝安区|文昌街|深圳市南山区|文昌商行|深圳市水贝一路73
开始导航,返回|主界面|通知栏|广昌巷|深圳市龙岗区|吉昌巷|文昌路|深圳市宝安区|文昌街|深圳市南山区|文昌商行|深圳市水贝一路73
帮我导航到迎宾大街长安路口,返回|主界面|通知栏|路线偏好|距离最短|9小时6分钟|763公里|红绿灯16个|收费405元|方案2|9小时7分钟|783公里|方案3|9小时43分钟|821公里|开始导航|缩小图面|放大图面|仅供测试
到迎宾宾馆,返回|主界面|通知栏|迎宾旅馆江北大街|温州市永嘉县|长安汽车超市罗浮大街|中大街|温州市乐清市|新大街|长安桥
就在站前二街16号,返回|主界面|通知栏|迎宾宾馆站前二街|温州市站前二街16号|迎宾宾馆广场路|温州市广场路19
导航吧,返回|主界面|通知栏|迎宾宾馆站前二街|距离60|地址温州市站前二街16号
我要去建湖宾馆,返回|主界面|通知栏|缩小图面|放大图面|仅供测试
去向阳西路88号,返回|主界面|通知栏|温州锐思特汽车连锁酒店西站店|鹿城区鹿城路139号旅游集散中心对面|详情下拉图片|温州伯特利商务宾馆|鹿城区鹿城路229号|温州众豪连锁酒店水心店|马鞍池西路308号|速8酒店温州将军桥店|鹿城区将军桥路19号|温州皇都宾馆|雪山路勤奋小区3号楼
到建湖宾馆-健身房,返回|主界面|通知栏|温州锐思特汽车连锁酒店西站店|鹿城区鹿城路139号旅游集散中心对面|详情下拉图片|温州伯特利商务宾馆|鹿城区鹿城路229号|温州众豪连锁酒店水心店|马鞍池西路308号|速8酒店温州将军桥店|鹿城区将军桥路19号|温州皇都宾馆|雪山路勤奋小区3号楼
开始导航,返回|主界面|通知栏|建湖宾馆停车场|盐城市向阳西路88号|建湖宾馆南1门|盐城市建湖县|建湖宾馆南2门|建湖宾馆湖中路店|增益宾馆
导航到平遥古城,返回|主界面|通知栏|路线偏好|距离最短|9小时34分钟|800公里|红绿灯19个|收费415元|方案2|9小时36分钟|820公里|方案3|10小时12分钟|857公里|开始导航|缩小图面|放大图面|仅供测试
去停车场,返回|主界面|通知栏|路线偏好|距离最短|9小时34分钟|800公里|红绿灯19个|收费415元|方案2|9小时36分钟|820公里|方案3|10小时12分钟|857公里|开始导航|缩小图面|放大图面|仅供测试
搜索平遥古城周围的小吃街,返回|主界面|通知栏|古矿物业洗浴停车场|晋城市城区|停车场科教路|停车场|停车场古阎路
开始导航吧,返回|主界面|通知栏|小吃点|晋中市照壁南街58号平遥古城内|古城小吃|晋中市西大街8|民间小吃
前往澳门,返回|主界面|通知栏|路线偏好|距离最短|9小时34分钟|800公里|红绿灯19个|收费415元|方案2|9小时36分钟|820公里|方案3|10小时12分钟|857公里|开始导航|缩小图面|放大图面|仅供测试
去澳门塔,返回|主界面|通知栏|路线偏好|距离最短|9小时34分钟|800公里|红绿灯19个|收费415元|方案2|9小时36分钟|820公里|方案3|10小时12分钟|857公里|开始导航|缩小图面|放大图面|仅供测试
选择不走高架的路线,返回|主界面|通知栏|澳门塔|距离406|地址澳门特别行政区澳门半岛
导航,返回|主界面|通知栏|澳门塔|距离406|地址澳门特别行政区澳门半岛
我想去广场,返回|主界面|通知栏|加载中
那就去石龙文化广场,返回|主界面|通知栏|天成广场|广元市利州区|永康广场|广元市青川县|世纪广场|利州广场|天剑广场
选择最快的路线,返回|主界面|通知栏|周易文化研究会石龙区联络处|平顶山市和谐路18|平顶山市石龙区文化广播电视局|平顶山市人民路南13号院
开始导航,返回|主界面|通知栏|周易文化研究会石龙区联络处|平顶山市和谐路18|平顶山市石龙区文化广播电视局|平顶山市人民路南13号院
帮我导航到实验小学,返回|主界面|通知栏|路线偏好|时间最短|15小时32分钟|1361公里|红绿灯28个|收费690元|距离最短|15小时34分钟|1353公里|方案3|17小时53分钟|1516公里|开始导航|设置车牌避开澳门特别行政区外地车限行|缩小图面|放大图面|仅供测试
到北京市第二实验小学,返回|主界面|通知栏|爱乐实验小学|北京城区石景山区|怀柔实验小学|北京城区小中富乐一区196|星河实验小学|北京城区四季星河路1|昌平实验小学|北京城区风雅园三区13|花家地实验小学|北京城区花家地小区18号楼
位于新文化街,返回|主界面|通知栏|北京第二实验小学|北京城区新文化街111|北京市昌平第二实验小学|北京城区回龙观龙泽苑东区|北京第二实验小学东门|北京城区安德路142|北京第二实验小学南门|北京第二实验小学北门|北京城区西城区
选择距离最近的,返回|主界面|通知栏|北京第二实验小学|北京城区新文化街111|北京市昌平第二实验小学|北京城区回龙观龙泽苑东区|北京第二实验小学东门|北京城区安德路142|北京第二实验小学南门|北京第二实验小学北门|北京城区西城区
导航开始,返回|主界面|通知栏|北京第二实验小学南门|距离65|地址北京城区东绒线胡同41
前往赣州市赣县茅店镇,返回|主界面|通知栏|加载中
就在茅店圩,返回|主界面|通知栏|茅店镇|距离603|地址赣州市赣县
要走最近的路线,返回|主界面|通知栏|茅店镇|距离603|地址赣州市赣县
导航,返回|主界面|通知栏|茅店镇|距离603|地址赣州市赣县
我要去驼山,返回|主界面|通知栏|加载中
去驮山桥,返回|主界面|通知栏|驮山|距离65|地址温州市文成县
搜索沿途有加油站的路线,返回|主界面|通知栏|驮山桥|距离94|地址温州市泰顺县
导航,返回|主界面|通知栏|路线偏好|时间最短|9小时24分钟|849公里|红绿灯8个|收费425元|方案2|9小时52分钟|865公里|开始导航|设置车牌避开南昌市外地车限行|缩小图面|放大图面|仅供测试
导航到吴中路五十二号,返回|主界面|通知栏|路线偏好|时间最短|9小时24分钟|849公里|红绿灯8个|收费425元|方案2|9小时52分钟|865公里|开始导航|设置车牌避开南昌市外地车限行|缩小图面|放大图面|仅供测试
就是北京路二号桥,返回|主界面|通知栏|十二图|苏州市吴中区|十二生肖石
选择不走高速,返回|主界面|通知栏|十二图|苏州市吴中区|十二生肖石
开始导航,返回|主界面|通知栏|4机场高速|杭州市滨江区|杭州市萧山区|2杭甬高速|杭州市江干区|9苏绍高速|杭州市余杭区
我想去王桥路五十五号,返回|主界面|通知栏|路线偏好|时间最短|9小时24分钟|849公里|红绿灯8个|收费425元|方案2|9小时52分钟|865公里|开始导航|设置车牌避开南昌市外地车限行|缩小图面|放大图面|仅供测试
就是艮山支三路5,返回|主界面|通知栏|飞云江路五十五号自行车租赁点|杭州市上城区|上塘路四百五十五号自行车租赁点|杭州市拱墅区|五号路|杭州市下城区|五号门|杭州市萧山区|杭州市富阳区
去聚落五号创意产业园停车场,返回|主界面|通知栏|飞云江路五十五号自行车租赁点|杭州市上城区|上塘路四百五十五号自行车租赁点|杭州市拱墅区|五号路|杭州市下城区|五号门|杭州市萧山区|杭州市富阳区
走高速路线,返回|主界面|通知栏|聚落五号创意产业园|杭州市艮山支三路5|聚落五号创意产业园西门|杭州市艮山支三路5号|6号创意产业园停车场|杭州市秋涛北路373|紫荆城创意产业园停车场|杭州市西湖区|西溪乐谷创意产业园停车场
开始导航,返回|主界面|通知栏|聚落五号创意产业园|杭州市艮山支三路5|聚落五号创意产业园西门|杭州市艮山支三路5号|6号创意产业园停车场|杭州市秋涛北路373|紫荆城创意产业园停车场|杭州市西湖区|西溪乐谷创意产业园停车场
帮我导航到洋山港客运码头,返回|主界面|通知栏|路线偏好|时间最短|9小时24分钟|849公里|红绿灯8个|收费425元|方案2|9小时52分钟|865公里|开始导航|设置车牌避开南昌市外地车限行|缩小图面|放大图面|仅供测试
位于三里洋路10,返回|主界面|通知栏|客运码头|杭州市千岛湖镇排岭南路177号|阳光客运码头|杭州市阳光线|千岛湖客运码头|杭州市滨湖支路与滨湖景观大道交叉口|御码头|杭州市龙井路1号杭州西湖风景名胜区内|俞赵货运码头|杭州市桐庐县
是杭州三里洋码头二港区，不是二港区,返回|主界面|通知栏|客运码头|杭州市千岛湖镇排岭南路177号|阳光客运码头|杭州市阳光线|千岛湖客运码头|杭州市滨湖支路与滨湖景观大道交叉口|御码头|杭州市龙井路1号杭州西湖风景名胜区内|俞赵货运码头|杭州市桐庐县
导航吧,返回|主界面|通知栏|客运码头|杭州市千岛湖镇排岭南路177号|阳光客运码头|杭州市阳光线|千岛湖客运码头|杭州市滨湖支路与滨湖景观大道交叉口|御码头|杭州市龙井路1号杭州西湖风景名胜区内|俞赵货运码头|杭州市桐庐县
前往吴中路中山西路口,返回|主界面|通知栏|路线偏好|时间最短|9小时24分钟|849公里|红绿灯8个|收费425元|方案2|9小时52分钟|865公里|开始导航|设置车牌避开南昌市外地车限行|缩小图面|放大图面|仅供测试
去中山北路和中山西路,返回|主界面|通知栏|路线偏好|时间最短|9小时24分钟|849公里|红绿灯8个|收费425元|方案2|9小时52分钟|865公里|开始导航|设置车牌避开南昌市外地车限行|缩小图面|放大图面|仅供测试
不是中山东路，是北路,返回|主界面|通知栏|中山北路|距离24|地址杭州市下城区
导航,返回|主界面|通知栏|中山北路|距离24|地址杭州市下城区
我要去海角七号,返回|主界面|通知栏|加载中
深圳海角七号精品酒店,返回|主界面|通知栏|顺城七号|西安市碑林区|汇通七号|西安市未央区|梦焕七号|西安市户县|七号馆|西安市雁塔区|七号桥|西安市莲湖区
